{
  "$schema": "http://json-schema.org/draft-07/schema#",
  "title": "dopeTask TaskPacket - strict repo policy",
  "description": "Strict Task Packet contract for repo-bound, series-driven execution with mandatory repo identity binding, explicit execution metadata, verification evidence, and Gemini-required PAL chaining.",
  "type": "object",
  "properties": {
    "id": {
      "type": "string",
      "minLength": 1
    },
    "project": {
      "type": "string",
      "minLength": 1
    },
    "target": {
      "type": "string",
      "minLength": 1
    },
    "invariants": {
      "type": "array",
      "minItems": 1,
      "items": {
        "type": "string",
        "minLength": 1
      }
    },
    "depends_on": {
      "type": "array",
      "items": {
        "type": "string",
        "minLength": 1
      },
      "default": []
    },
    "repo_binding": {
      "type": "object",
      "properties": {
        "project_id": {
          "type": "string",
          "minLength": 1
        },
        "repo_marker": {
          "type": "string",
          "minLength": 1
        },
        "origin_hint": {
          "type": "string"
        },
        "require_identity_match": {
          "type": "boolean"
        }
      },
      "required": [
        "project_id",
        "repo_marker",
        "require_identity_match"
      ],
      "additionalProperties": false
    },
    "series": {
      "type": "object",
      "properties": {
        "id": {
          "type": "string",
          "minLength": 1
        },
        "base_branch": {
          "type": "string",
          "minLength": 1
        },
        "parent_tp_id": {
          "type": [
            "string",
            "null"
          ]
        },
        "final_packet": {
          "type": "boolean"
        }
      },
      "required": [
        "id",
        "base_branch",
        "parent_tp_id",
        "final_packet"
      ],
      "additionalProperties": false
    },
    "execution": {
      "type": "object",
      "properties": {
        "agent": {
          "type": "string",
          "enum": [
            "gemini",
            "codex",
            "claude_code",
            "vibe",
            "shell"
          ]
        },
        "branch": {
          "type": "string",
          "minLength": 1
        }
      },
      "required": [
        "agent",
        "branch"
      ],
      "additionalProperties": false
    },
    "commit": {
      "type": "object",
      "properties": {
        "message": {
          "type": "string",
          "minLength": 1
        },
        "allowlist": {
          "type": "array",
          "minItems": 1,
          "items": {
            "type": "string",
            "minLength": 1
          }
        },
        "verify": {
          "type": "array",
          "minItems": 1,
          "items": {
            "type": "string",
            "minLength": 1
          }
        }
      },
      "required": [
        "message",
        "allowlist",
        "verify"
      ],
      "additionalProperties": false
    },
    "pr": {
      "type": "object",
      "properties": {
        "title": {
          "type": "string",
          "minLength": 1
        },
        "body": {
          "type": "string",
          "minLength": 1
        },
        "base": {
          "type": "string",
          "minLength": 1
        }
      },
      "required": [
        "title",
        "body",
        "base"
      ],
      "additionalProperties": false
    },
    "pal_chain": {
      "type": "object",
      "properties": {
        "enabled": {
          "type": "boolean"
        },
        "steps": {
          "type": "array",
          "minItems": 1,
          "items": {
            "type": "string",
            "minLength": 1
          }
        }
      },
      "required": [
        "enabled",
        "steps"
      ],
      "additionalProperties": false
    },
    "steps": {
      "type": "array",
      "minItems": 1,
      "items": {
        "type": "object",
        "properties": {
          "id": {
            "type": "string",
            "minLength": 1
          },
          "task": {
            "type": "string",
            "minLength": 1
          },
          "requirements": {
            "type": "array",
            "items": {
              "type": "string",
              "minLength": 1
            }
          },
          "commands": {
            "type": "array",
            "items": {
              "type": "string",
              "minLength": 1
            }
          },
          "expected_files": {
            "type": "array",
            "items": {
              "type": "string",
              "minLength": 1
            }
          },
          "validation": {
            "type": "array",
            "minItems": 1,
            "items": {
              "type": "string",
              "minLength": 1
            }
          },
          "context_files": {
            "type": "array",
            "items": {
              "type": "string",
              "minLength": 1
            }
          }
        },
        "required": [
          "id",
          "task",
          "validation"
        ],
        "additionalProperties": false
      }
    }
  },
  "required": [
    "id",
    "project",
    "target",
    "invariants",
    "repo_binding",
    "series",
    "execution",
    "commit",
    "pr",
    "steps"
  ],
  "allOf": [
    {
      "if": {
        "properties": {
          "execution": {
            "properties": {
              "agent": {
                "const": "gemini"
              }
            },
            "required": [
              "agent"
            ]
          }
        },
        "required": [
          "execution"
        ]
      },
      "then": {
        "required": [
          "pal_chain"
        ],
        "properties": {
          "pal_chain": {
            "properties": {
              "enabled": {
                "const": true
              }
            },
            "required": [
              "enabled"
            ]
          }
        }
      }
    }
  ],
  "additionalProperties": false
}
