{
  "id": "TP-DT-UI-REPORT-0001",
  "project": "dopetask",
  "target": "Add a read-only dopetask report <series_id> markdown command rendered from the accepted UiStatus collector.",
  "invariants": [
    "dopeTask remains runtime authority.",
    "dope-agent-system remains asset/template/reference authority only; this packet performs no dope-agent-system writes.",
    "PAL/clink remains planning/context only and is not execution transport.",
    "This packet is markdown report only.",
    "Dependency observed: TP-DT-UI-STATUS-0001 at commit 8c50b3c36548ad70835956ef86e2cd52d6e5131d.",
    "Do not implement dopetask cockpit, Asset Library UI, DAS file listing or preview, mutating launchers, or audit panes.",
    "Do not add textual, dependencies, pyproject.toml changes, uv.lock changes, runner implementation changes, adapter behavior changes, or routing scoring changes.",
    "Do not call dopetask doctor, dopetask route plan, tp series exec, tp exec, or any task execution command.",
    "Do not write SERIES_STATE.json, EXEC.json, EXEC_ERROR.json, SERIES_CONTEXT.json, ROUTE_PLAN.json, proof bundles, or out/tp_series artifacts.",
    "The report must consume collect_status() and must not duplicate low-level artifact parsing.",
    "Report stdout mode must be read-only.",
    "--out may write only to the explicitly requested output path and must refuse proof/ and resolved dope-agent-system paths when known."
  ],
  "depends_on": [
    "TP-DT-UI-STATUS-0001"
  ],
  "repo_binding": {
    "project_id": "dopetask.core",
    "repo_marker": ".dopetaskroot",
    "origin_hint": "local:/Users/hue/code/dopeTask",
    "require_identity_match": true
  },
  "series": {
    "id": "SERIES-DT-UI-CONTRACTS",
    "base_branch": "main",
    "parent_tp_id": "TP-DT-UI-STATUS-0001",
    "final_packet": true
  },
  "execution": {
    "agent": "codex",
    "branch": "main"
  },
  "commit": {
    "message": "feat(ui): add markdown series report",
    "allowlist": [
      "src/dopetask/ui/report.py",
      "src/dopetask/ui/__init__.py",
      "src/dopetask/cli.py",
      "tests/ui/test_report.py",
      "tests/ui/fixtures/",
      "task-packets/TP-DT-UI-REPORT-0001.json",
      "proof/TP-DT-UI-REPORT-0001/PROOF.json",
      "proof/TP-DT-UI-REPORT-0001/IMPLEMENTER_REPORT.md"
    ],
    "verify": [
      "python3 -m json.tool task-packets/TP-DT-UI-REPORT-0001.json",
      "python3 -m json.tool proof/TP-DT-UI-REPORT-0001/PROOF.json",
      "python3 -m pytest tests/ui/test_report.py -v",
      "python3 -m pytest tests/ui/test_status.py -v",
      "python3 -m pytest tests/ui/test_runner_health.py -v",
      "python3 -m pytest tests/test_workspace.py -v",
      "python3 -m compileall -q src tests",
      "python3 -m dopetask ui status --json | python3 -m json.tool",
      "python3 -m dopetask report SERIES-AUDIT-057B-PROMPT-PIPELINE",
      "python3 -m dopetask report SERIES-AUDIT-057B-PROMPT-PIPELINE --out /tmp/dopetask_report_tp_dt_ui_report_0001.md",
      "test -s /tmp/dopetask_report_tp_dt_ui_report_0001.md",
      "grep -n \"Durability\" /tmp/dopetask_report_tp_dt_ui_report_0001.md",
      "grep -n \"Auth Mode\" /tmp/dopetask_report_tp_dt_ui_report_0001.md",
      "git diff --check",
      "git status --short",
      "grep -R \"import textual\\|from textual\" src/dopetask tests || true",
      "grep -R \"dopetask doctor\\|route plan\\|tp series exec\" src/dopetask/ui tests/ui || true",
      "grep -R \"auth_mode.*subscription\\|Auth Mode.*subscription\" tests/ui src/dopetask/ui/report.py || true"
    ]
  },
  "pr": {
    "title": "Add markdown series report",
    "body": "Adds a read-only markdown report surface rendered from UiStatus with durability and auth metadata.",
    "base": "main"
  },
  "steps": [
    {
      "id": "step_1_inspect_authority",
      "task": "Inspect accepted UiStatus collector, durability classifier, CLI registration, tests, and design artifacts before editing.",
      "requirements": [
        "Treat UiStatus as the report data authority.",
        "Treat collect_status() as the required report input layer.",
        "Do not duplicate low-level runtime artifact parsing in report.py."
      ],
      "commands": [],
      "expected_files": [],
      "validation": [
        "git rev-parse HEAD",
        "python3 -m json.tool proof/TP-DT-UI-STATUS-0001/PROOF.json"
      ],
      "context_files": [
        "src/dopetask/ui/status.py",
        "src/dopetask/ui/durability.py",
        "src/dopetask/cli.py",
        "dopetask_schemas/ui_status.schema.json",
        "tests/ui/test_status.py",
        "tests/ui/test_runner_health.py",
        "tests/test_workspace.py",
        "out/design/TP-DT-TUI-OPUS-DESIGN-0001/OPUS_TUI_DESIGN_VERDICT.md",
        "out/design/TP-DT-TUI-OPUS-DESIGN-0001/TUI_DATA_ARCHITECTURE.md",
        "out/design/TP-DT-TUI-OPUS-DESIGN-0001/TUI_TP_SEQUENCE.md",
        "out/design/TP-DT-TUI-OPUS-DESIGN-0001/TUI_IMPLEMENTATION_PLAN.md",
        "out/design/TP-DT-TUI-OPUS-DESIGN-0001/TUI_AUTHORITY_AND_SAFETY_MODEL.md",
        "out/design/TP-DT-TUI-OPUS-DESIGN-0001/TUI_RED_TEAM_REVIEW.md"
      ]
    },
    {
      "id": "step_2_report_cli_tests",
      "task": "Create the markdown report renderer, register dopetask report <series_id>, and add focused report tests.",
      "requirements": [
        "Report title, metadata, status summary, packet table, durability section, runner health summary, warnings/errors, and safety footer must render from UiStatus.",
        "Auth mode must render literally from UiStatus; missing values render as unknown.",
        "Durability column and artifact durability section are mandatory.",
        "--out must refuse proof/ and resolved dope-agent-system paths."
      ],
      "commands": [],
      "expected_files": [
        "src/dopetask/ui/report.py",
        "src/dopetask/cli.py",
        "tests/ui/test_report.py"
      ],
      "validation": [
        "python3 -m pytest tests/ui/test_report.py -v",
        "python3 -m dopetask report SERIES-AUDIT-057B-PROMPT-PIPELINE"
      ],
      "context_files": [
        "src/dopetask/ui/status.py",
        "src/dopetask/ui/durability.py",
        "src/dopetask/cli.py"
      ]
    },
    {
      "id": "step_3_proof_commit",
      "task": "Create proof and implementer report artifacts, run validation commands, and commit only allowlisted files if clean.",
      "requirements": [
        "Proof must record validation exit codes.",
        "Proof must include output refusal checks and self-referential commit hash caveat.",
        "Commit only allowlisted files."
      ],
      "commands": [
        "python3 -m json.tool task-packets/TP-DT-UI-REPORT-0001.json",
        "python3 -m json.tool proof/TP-DT-UI-REPORT-0001/PROOF.json",
        "python3 -m pytest tests/ui/test_report.py -v",
        "python3 -m pytest tests/ui/test_status.py -v",
        "python3 -m pytest tests/ui/test_runner_health.py -v",
        "python3 -m pytest tests/test_workspace.py -v",
        "python3 -m compileall -q src tests",
        "python3 -m dopetask ui status --json | python3 -m json.tool",
        "python3 -m dopetask report SERIES-AUDIT-057B-PROMPT-PIPELINE",
        "python3 -m dopetask report SERIES-AUDIT-057B-PROMPT-PIPELINE --out /tmp/dopetask_report_tp_dt_ui_report_0001.md",
        "test -s /tmp/dopetask_report_tp_dt_ui_report_0001.md",
        "grep -n \"Durability\" /tmp/dopetask_report_tp_dt_ui_report_0001.md",
        "grep -n \"Auth Mode\" /tmp/dopetask_report_tp_dt_ui_report_0001.md",
        "git diff --check",
        "git status --short"
      ],
      "expected_files": [
        "task-packets/TP-DT-UI-REPORT-0001.json",
        "proof/TP-DT-UI-REPORT-0001/PROOF.json",
        "proof/TP-DT-UI-REPORT-0001/IMPLEMENTER_REPORT.md"
      ],
      "validation": [
        "python3 -m pytest tests/ui/test_report.py -v",
        "python3 -m compileall -q src tests",
        "git diff --check",
        "git status --short"
      ],
      "context_files": [
        "tests/ui/test_report.py"
      ]
    }
  ]
}
